gene_id,gene,product,status,main,sub,path,ecpath,baseMean,log2FoldChange,lfcSE,stat,pvalue,padj,contrast,Length,organism,protein_id
TX50_RS00020,dnaN,DNA polymerase III subunit beta,no_significant,09120 Genetic Information Processing // 09180 Brite Hierarchies,09124 Replication and repair // 09182 Protein families: genetic information processing,03030 DNA replication [PATH:ko03030] // 03430 Mismatch repair [PATH:ko03430] // 03440 Homologous recombination [PATH:ko03440] // 03032 DNA replication proteins [BR:ko03032] // 03400 DNA repair and recombination proteins [BR:ko03400],K02338  dnaN; DNA polymerase III subunit beta [EC:2.7.7.7],1382.0164787029485,0.5992360862843813,0.12124343585894119,0.8184862593290081,0.41307958489156144,1,treatment_long.term_vs_ref,1155,MED4,WP_011131639.1
TX50_RS00025,TX50_RS00025,hypothetical protein,no_significant,,,,,105.18225762083556,-0.6023740362440139,0.2036270630987823,-0.5027526041288077,0.6151382201106783,1,treatment_long.term_vs_ref,705,MED4,WP_011131640.1
TX50_RS00030,purL,phosphoribosylformylglycinamidine synthase subunit PurL,up,09100 Metabolism,09104 Nucleotide metabolism,00230 Purine metabolism [PATH:ko00230],K23269  purL; phosphoribosylformylglycinamidine synthase subunit PurL [EC:6.3.5.3],688.4677651867247,1.0799453015805798,0.15146136387848197,3.828998278702099,1.2866590675215362e-4,0.0011191344103915163,treatment_long.term_vs_ref,2337,MED4,WP_011131641.1
TX50_RS00035,purF,amidophosphoribosyltransferase,no_significant,09100 Metabolism // 09180 Brite Hierarchies,09104 Nucleotide metabolism // 09105 Amino acid metabolism // 09181 Protein families: metabolism,"00230 Purine metabolism [PATH:ko00230] // 00250 Alanine, aspartate and glutamate metabolism [PATH:ko00250] // 01002 Peptidases and inhibitors [BR:ko01002]","K00764  purF, PPAT; amidophosphoribosyltransferase [EC:2.4.2.14]",350.6688232343651,0.07797915914704599,0.12701804164623307,0,1,1,treatment_long.term_vs_ref,1458,MED4,WP_011131642.1
TX50_RS00040,TX50_RS00040,DNA topoisomerase 4 subunit A,no_significant,09180 Brite Hierarchies,09182 Protein families: genetic information processing,03032 DNA replication proteins [BR:ko03032] // 03400 DNA repair and recombination proteins [BR:ko03400],K02469  gyrA; DNA gyrase subunit A [EC:5.6.2.2],636.5248086641053,0.04297486317955946,0.11375006644398578,0,1,1,treatment_long.term_vs_ref,2439,MED4,WP_011131643.1
TX50_RS00045,TX50_RS00045,tetratricopeptide repeat protein,no_significant,,,,,105.80150336387102,0.3269641699170614,0.2218384549541338,0,1,1,treatment_long.term_vs_ref,852,MED4,WP_011131644.1
TX50_RS00050,queG,tRNA epoxyqueuosine(34) reductase QueG,up,09180 Brite Hierarchies,09182 Protein families: genetic information processing,03016 Transfer RNA biogenesis [BR:ko03016],K18979  queG; epoxyqueuosine reductase [EC:1.17.99.6],278.5660197898978,1.5591593468360445,0.1696638764534572,6.242692133269729,4.3010295129730334e-10,9.844578663027165e-9,treatment_long.term_vs_ref,942,MED4,WP_011131645.1
TX50_RS00055,TX50_RS00055,DUF502 domain-containing protein,no_significant,,,,,1765.18331823087,0.5845511432198663,0.16340988681419602,0.5174175496247946,0.6048647114123624,1,treatment_long.term_vs_ref,735,MED4,WP_011131646.1
TX50_RS00060,nusB,transcription antitermination factor NusB,no_significant,09180 Brite Hierarchies,09182 Protein families: genetic information processing,03021 Transcription machinery [BR:ko03021] // 03009 Ribosome biogenesis [BR:ko03009],K03625  nusB; transcription antitermination protein NusB,145.39816232609445,-0.3871150403922745,0.2528275871296698,-0,1,1,treatment_long.term_vs_ref,624,MED4,WP_036930720.1
TX50_RS00065,ftsY,signal recognition particle-docking protein FtsY,no_significant,09120 Genetic Information Processing // 09130 Environmental Information Processing // 09140 Cellular Processes // 09180 Brite Hierarchies,"09123 Folding, sorting and degradation // 09131 Membrane transport // 09145 Cellular community - prokaryotes // 09183 Protein families: signaling and cellular processes",03060 Protein export [PATH:ko03060] // 03070 Bacterial secretion system [PATH:ko03070] // 02024 Quorum sensing [PATH:ko02024] // 02044 Secretion system [BR:ko02044],K03110  ftsY; fused signal recognition particle receptor,242.4447318062237,-0.01807185903900713,0.18332420453013237,-0,1,1,treatment_long.term_vs_ref,1320,MED4,WP_011131648.1
TX50_RS00070,TX50_RS00070,serine/threonine-protein phosphatase,no_significant,09180 Brite Hierarchies,09182 Protein families: genetic information processing,03021 Transcription machinery [BR:ko03021],K07315  rsbU_P; phosphoserine phosphatase RsbU/P [EC:3.1.3.3],116.38634461925892,-0.38582511719020357,0.17682863679756017,-0,1,1,treatment_long.term_vs_ref,1341,MED4,WP_011131649.1
TX50_RS00075,argH,argininosuccinate lyase,no_significant,09100 Metabolism // 09180 Brite Hierarchies,09105 Amino acid metabolism // 09183 Protein families: signaling and cellular processes,"00250 Alanine, aspartate and glutamate metabolism [PATH:ko00250] // 00220 Arginine biosynthesis [PATH:ko00220] // 04147 Exosome [BR:ko04147]","K01755  argH, ASL; argininosuccinate lyase [EC:4.3.2.1]",279.6117291095901,-0.24739848496474892,0.17327092878689102,-0,1,1,treatment_long.term_vs_ref,1377,MED4,WP_011131650.1
TX50_RS00080,TX50_RS00080,RNA-binding protein,no_significant,,,,,3752.5604670725334,0.20338303267681138,0.2166767453550795,0,1,1,treatment_long.term_vs_ref,600,MED4,WP_042116203.1
TX50_RS00085,dusA,tRNA dihydrouridine(20/20a) synthase DusA,no_significant,09180 Brite Hierarchies,09182 Protein families: genetic information processing,03016 Transfer RNA biogenesis [BR:ko03016],K05539  dusA; tRNA-dihydrouridine synthase A [EC:1.-.-.-],134.86395753326312,1.3377177633418298,0.29884104483036766,2.803221906205511,0.005059484442816,0.02672445628769477,treatment_long.term_vs_ref,1002,MED4,WP_011131652.1
TX50_RS00090,msrB,peptide-methionine (R)-S-oxide reductase MsrB,up,09190 Not Included in Pathway or Brite,09191 Unclassified: metabolism,99980 Enzymes with EC numbers,K07305  msrB; peptide-methionine (R)-S-oxide reductase [EC:1.8.4.12],515.5025856959525,1.4203742394336203,0.1780915370212806,5.167984143590397,2.3663238002719042e-7,3.5380357465355727e-6,treatment_long.term_vs_ref,492,MED4,WP_011131653.1
TX50_RS00095,grpE,nucleotide exchange factor GrpE,no_significant,09180 Brite Hierarchies,09182 Protein families: genetic information processing,03110 Chaperones and folding catalysts [BR:ko03110] // 03029 Mitochondrial biogenesis [BR:ko03029],K03687  GRPE; molecular chaperone GrpE,2154.5237528337498,0.5802420026257514,0.18473175478001494,0.4343703805623804,0.66401950294311185,1,treatment_long.term_vs_ref,717,MED4,WP_011131654.1
TX50_RS00100,dnaJ,molecular chaperone DnaJ,no_significant,09180 Brite Hierarchies,09182 Protein families: genetic information processing,03110 Chaperones and folding catalysts [BR:ko03110] // 03029 Mitochondrial biogenesis [BR:ko03029],K03686  dnaJ; molecular chaperone DnaJ,849.4904008475849,1.0632444206038478,0.1741552052248119,3.234152087942315,0.0012200446687527457,0.008136556891610037,treatment_long.term_vs_ref,1122,MED4,WP_011131655.1
TX50_RS00105,TX50_RS00105,sulfurtransferase TusA family protein,no_significant,,,,,137.00857545378096,1.0127914493649213,0.20550483914365325,2.495276760886719,0.012585892195220143,0.05833561032484536,treatment_long.term_vs_ref,231,MED4,WP_011131656.1
TX50_RS00110,rsgA,ribosome small subunit-dependent GTPase A,up,09100 Metabolism // 09180 Brite Hierarchies,09108 Metabolism of cofactors and vitamins // 09182 Protein families: genetic information processing,00730 Thiamine metabolism [PATH:ko00730] // 03009 Ribosome biogenesis [BR:ko03009],"K06949  rsgA, engC; ribosome biogenesis GTPase / thiamine phosphate phosphatase [EC:3.6.1.- 3.1.3.100]",117.9895211273716,1.7166067709144857,0.35900218346311835,3.3888561879442505,7.018480945976604e-4,0.004891828448812264,treatment_long.term_vs_ref,915,MED4,WP_011131657.1
TX50_RS00115,TX50_RS00115,YbaB/EbfC family nucleoid-associated protein,no_significant,09190 Not Included in Pathway or Brite,09192 Unclassified: genetic information processing,99998 Others,K09747  ebfC; nucleoid-associated protein EbfC,1111.0394833381336,-0.9033243298839262,0.23126257834352287,-1.744010348638502,0.08115728533228009,0.28389737170952317,treatment_long.term_vs_ref,348,MED4,WP_011131658.1
TX50_RS00120,murB,UDP-N-acetylmuramate dehydrogenase,no_significant,09100 Metabolism // 09180 Brite Hierarchies,09101 Carbohydrate metabolism // 09107 Glycan biosynthesis and metabolism // 09181 Protein families: metabolism,00520 Amino sugar and nucleotide sugar metabolism [PATH:ko00520] // 00550 Peptidoglycan biosynthesis [PATH:ko00550] // 01011 Peptidoglycan biosynthesis and degradation proteins [BR:ko01011],K00075  murB; UDP-N-acetylmuramate dehydrogenase [EC:1.3.1.98],43.036440332956715,0.48294593766306104,0.28237601667655277,0,1,1,treatment_long.term_vs_ref,888,MED4,WP_011131659.1
TX50_RS00125,murC,UDP-N-acetylmuramate--L-alanine ligase,no_significant,09100 Metabolism // 09180 Brite Hierarchies,09107 Glycan biosynthesis and metabolism // 09181 Protein families: metabolism,00550 Peptidoglycan biosynthesis [PATH:ko00550] // 01011 Peptidoglycan biosynthesis and degradation proteins [BR:ko01011],K01924  murC; UDP-N-acetylmuramate--alanine ligase [EC:6.3.2.8],154.35085987289204,0.42762781634541114,0.220424263989951,0,1,1,treatment_long.term_vs_ref,1419,MED4,WP_011131660.1
TX50_RS00130,gap,type I glyceraldehyde-3-phosphate dehydrogenase,down,09100 Metabolism,09101 Carbohydrate metabolism // 09102 Energy metabolism,00010 Glycolysis / Gluconeogenesis [PATH:ko00010] // 00710 Carbon fixation in photosynthetic organisms [PATH:ko00710],K00150  gap2; glyceraldehyde-3-phosphate dehydrogenase (NAD(P)) [EC:1.2.1.59],5045.045282998278,-1.7901142211056602,0.25737666971043155,-5.012553090212634,5.371254897440599e-7,7.268836919602096e-6,treatment_long.term_vs_ref,1020,MED4,WP_011131661.1
TX50_RS00135,TX50_RS00135,thiamine-phosphate kinase,no_significant,09100 Metabolism,09108 Metabolism of cofactors and vitamins,00730 Thiamine metabolism [PATH:ko00730],K00946  thiL; thiamine-monophosphate kinase [EC:2.7.4.16],225.44558108219462,0.22555142711216913,0.13653421072559135,0,1,1,treatment_long.term_vs_ref,984,MED4,WP_011131662.1
TX50_RS00140,TX50_RS00140,peptidylprolyl isomerase,no_significant,,,,,1924.1411562418646,-0.3831871915537251,0.23794705688398998,-0,1,1,treatment_long.term_vs_ref,1089,MED4,WP_011131663.1
TX50_RS00145,efp,elongation factor P,no_significant,09180 Brite Hierarchies,09182 Protein families: genetic information processing,03012 Translation factors [BR:ko03012],K02356  efp; elongation factor P,897.8532469536284,-0.5993162482052379,0.1879159441614274,-0.5285142176116849,0.5971424817085418,1,treatment_long.term_vs_ref,558,MED4,WP_011131664.1
TX50_RS00150,accB,acetyl-CoA carboxylase biotin carboxyl carrier protein,no_significant,09100 Metabolism,09101 Carbohydrate metabolism // 09102 Energy metabolism // 09103 Lipid metabolism,00620 Pyruvate metabolism [PATH:ko00620] // 00640 Propanoate metabolism [PATH:ko00640] // 00720 Carbon fixation pathways in prokaryotes [PATH:ko00720] // 00061 Fatty acid biosynthesis [PATH:ko00061],"K02160  accB, bccP; acetyl-CoA carboxylase biotin carboxyl carrier protein",1058.0909787857097,-0.3553143273581159,0.1516303425634438,-0,1,1,treatment_long.term_vs_ref,504,MED4,WP_011131665.1
TX50_RS00155,pdxA,4-hydroxythreonine-4-phosphate dehydrogenase PdxA,no_significant,,,,,121.91451630663478,0.41135334714187344,0.19972299320803022,0,1,1,treatment_long.term_vs_ref,1038,MED4,WP_011131666.1
TX50_RS00160,TX50_RS00160,SDR family oxidoreductase,no_significant,,,,,179.1094904285827,-0.899184484102476,0.23079609660758094,-1.7295980736676115,0.08370211046449347,0.290606203747511,treatment_long.term_vs_ref,885,MED4,WP_011131667.1
TX50_RS00165,TX50_RS00165,transcription factor TFIID,no_significant,,,,,39.6717778301906,0.6398715303827514,0.37230040167018463,0.37569535180534525,0.7071433938926075,1,treatment_long.term_vs_ref,234,MED4,WP_152556136.1
TX50_RS00170,TX50_RS00170,HNH endonuclease,no_significant,,,,,273.2794695123108,-0.19956344168830797,0.18579080055242203,-0,1,1,treatment_long.term_vs_ref,402,MED4,WP_011131669.1
TX50_RS00175,TX50_RS00175,hypothetical protein,no_significant,,,,,101.93881730393375,1.2108308512203703,0.25834638019466266,2.7514643351486594,0.005932947983879586,0.030811444151576342,treatment_long.term_vs_ref,417,MED4,WP_011131670.1
TX50_RS00180,TX50_RS00180,AbrB family transcriptional regulator,no_significant,09190 Not Included in Pathway or Brite,09194 Poorly characterized,99997 Function unknown,K07120  K07120; uncharacterized protein,276.9683866078316,0.41207087927714264,0.1636481226413271,0,1,1,treatment_long.term_vs_ref,510,MED4,WP_011131671.1
TX50_RS00185,TX50_RS00185,hypothetical protein,no_significant,,,,,1165.2630406107937,0.645760031723427,0.23135830671534943,0.6300185793750736,0.5286824284499398,1,treatment_long.term_vs_ref,195,MED4,WP_011131672.1
TX50_RS00190,TX50_RS00190,alanine--glyoxylate aminotransferase family protein,no_significant,,,,,958.798809916874,-0.07500335846700455,0.1494117573482006,-0,1,1,treatment_long.term_vs_ref,1125,MED4,WP_036930403.1
TX50_RS00195,cbiD,cobalt-precorrin-5B (C(1))-methyltransferase CbiD,no_significant,09100 Metabolism,09108 Metabolism of cofactors and vitamins,00860 Porphyrin metabolism [PATH:ko00860],K02188  cbiD; cobalt-precorrin-5B (C1)-methyltransferase [EC:2.1.1.195],138.2239239216688,-0.17925256122080307,0.20790876392283733,-0,1,1,treatment_long.term_vs_ref,1116,MED4,WP_011131674.1
TX50_RS00200,guaA,glutamine-hydrolyzing GMP synthase,no_significant,09100 Metabolism // 09180 Brite Hierarchies,09104 Nucleotide metabolism // 09111 Xenobiotics biodegradation and metabolism // 09181 Protein families: metabolism,00230 Purine metabolism [PATH:ko00230] // 00983 Drug metabolism - other enzymes [PATH:ko00983] // 01002 Peptidases and inhibitors [BR:ko01002],"K01951  guaA, GMPS; GMP synthase (glutamine-hydrolysing) [EC:6.3.5.2]",587.0638672617935,0.14361397611918933,0.11074167606991321,0,1,1,treatment_long.term_vs_ref,1584,MED4,WP_011131675.1
TX50_RS00205,TX50_RS00205,PD-(D/E)XK nuclease family protein,no_significant,,,,,60.457054153513695,0.05262108231304543,0.18582554651652225,0,1,1,treatment_long.term_vs_ref,711,MED4,WP_011131676.1
TX50_RS00210,TX50_RS00210,hypothetical protein,no_significant,,,,,271.28712067021826,0.08392761278308283,0.22655284995700797,0,1,1,treatment_long.term_vs_ref,606,MED4,WP_011131677.1
TX50_RS00215,mrdA,penicillin-binding protein 2,no_significant,09100 Metabolism // 09160 Human Diseases // 09180 Brite Hierarchies,09107 Glycan biosynthesis and metabolism // 09175 Drug resistance: antimicrobial // 09181 Protein families: metabolism,00550 Peptidoglycan biosynthesis [PATH:ko00550] // 01501 beta-Lactam resistance [PATH:ko01501] // 01011 Peptidoglycan biosynthesis and degradation proteins [BR:ko01011],K05515  mrdA; penicillin-binding protein 2 [EC:3.4.16.4],170.10397963578728,0.7810577136216283,0.1550777491590806,1.8123664751757262,0.06992958934821093,0.24980627871210612,treatment_long.term_vs_ref,1788,MED4,WP_011131678.1
TX50_RS00220,TX50_RS00220,"NAD(P)H-dependent oxidoreductase",no_significant,09190 Not Included in Pathway or Brite,09191 Unclassified: metabolism,99988 Secondary metabolism,"K19784  chrR, NQR; chromate reductase, NAD(P)H dehydrogenase (quinone)",243.7797559413831,-1.008770462768559,0.26170495457745035,-1.9440612562724362,0.05188806464865596,0.19513280295863722,treatment_long.term_vs_ref,522,MED4,WP_011131679.1
TX50_RS00225,TX50_RS00225,diflavin flavoprotein,no_significant,,,,,371.3168628175885,0.6675526990003373,0.1531168886200866,1.0942796742433085,0.2738323369929463,0.736843472837333,treatment_long.term_vs_ref,1800,MED4,WP_011131680.1
TX50_RS00230,TX50_RS00230,diflavin flavoprotein,up,,,,,1839.971440027334,1.6233722533482544,0.21927416757777954,5.123139974752288,3.0048910699213954e-7,4.352396909089271e-6,treatment_long.term_vs_ref,1773,MED4,WP_011131681.1
TX50_RS00235,alaS,alanine--tRNA ligase,no_significant,09120 Genetic Information Processing // 09180 Brite Hierarchies,09122 Translation // 09181 Protein families: metabolism // 09182 Protein families: genetic information processing,00970 Aminoacyl-tRNA biosynthesis [PATH:ko00970] // 01007 Amino acid related enzymes [BR:ko01007] // 03016 Transfer RNA biogenesis [BR:ko03016],"K01872  AARS, alaS; alanyl-tRNA synthetase [EC:6.1.1.7]",939.5430399105334,-0.17281286388751196,0.12126208900521489,-0,1,1,treatment_long.term_vs_ref,2658,MED4,WP_011131682.1
TX50_RS00240,speA,biosynthetic arginine decarboxylase,no_significant,09100 Metabolism,09105 Amino acid metabolism,00330 Arginine and proline metabolism [PATH:ko00330],K01585  speA; arginine decarboxylase [EC:4.1.1.19],198.20066831601352,0.8554686579925179,0.19544342221704727,1.818780360884986,0.06894494576974786,0.24724164305050778,treatment_long.term_vs_ref,1944,MED4,WP_011131683.1
TX50_RS00245,ndk,nucleoside-diphosphate kinase,no_significant,09100 Metabolism // 09130 Environmental Information Processing // 09180 Brite Hierarchies,09104 Nucleotide metabolism // 09111 Xenobiotics biodegradation and metabolism // 09132 Signal transduction // 09182 Protein families: genetic information processing,00230 Purine metabolism [PATH:ko00230] // 00240 Pyrimidine metabolism [PATH:ko00240] // 00983 Drug metabolism - other enzymes [PATH:ko00983] // 04016 MAPK signaling pathway - plant [PATH:ko04016] // 04131 Membrane trafficking [BR:ko04131],"K00940  ndk, NME; nucleoside-diphosphate kinase [EC:2.7.4.6]",395.16584315536625,-0.5740699491678227,0.24484690379998947,-0.3025153596727896,0.7622592263168539,1,treatment_long.term_vs_ref,456,MED4,WP_011131684.1
TX50_RS00250,thiO,glycine oxidase ThiO,no_significant,,,,,222.9958809661753,0.7353970534103614,0.1757339607940043,1.3395080401465163,0.18040533877502957,0.5374139102897248,treatment_long.term_vs_ref,1107,MED4,WP_011131685.1
TX50_RS00255,gatB,Asp-tRNA(Asn)/Glu-tRNA(Gln) amidotransferase subunit GatB,no_significant,09120 Genetic Information Processing // 09180 Brite Hierarchies,09122 Translation // 09182 Protein families: genetic information processing,00970 Aminoacyl-tRNA biosynthesis [PATH:ko00970] // 03029 Mitochondrial biogenesis [BR:ko03029],"K02434  gatB, PET112; aspartyl-tRNA(Asn)/glutamyl-tRNA(Gln) amidotransferase subunit B [EC:6.3.5.6 6.3.5.7]",855.5567290420564,-0.06928431518433321,0.12084135343281814,-0,1,1,treatment_long.term_vs_ref,1470,MED4,WP_011131686.1
TX50_RS00260,coaE,dephospho-CoA kinase,no_significant,09100 Metabolism,09108 Metabolism of cofactors and vitamins,00770 Pantothenate and CoA biosynthesis [PATH:ko00770],K00859  coaE; dephospho-CoA kinase [EC:2.7.1.24],30.859728363038343,-0.7491141625425479,0.35551448395015806,-0.7007145244115368,0.4834811899433293,1,treatment_long.term_vs_ref,612,MED4,WP_011131687.1
TX50_RS00265,argJ,bifunctional glutamate N-acetyltransferase/amino-acid acetyltransferase ArgJ,no_significant,09100 Metabolism,09105 Amino acid metabolism,00220 Arginine biosynthesis [PATH:ko00220],K00620  argJ; glutamate N-acetyltransferase / amino-acid N-acetyltransferase [EC:2.3.1.35 2.3.1.1],101.09945689727816,1.116598574104553,0.2092223078417781,2.9470976611674145,0.0032077187831815635,0.018584720700058184,treatment_long.term_vs_ref,1236,MED4,WP_036930400.1
TX50_RS00270,TX50_RS00270,AAA family ATPase,no_significant,09180 Brite Hierarchies,09182 Protein families: genetic information processing // 09183 Protein families: signaling and cellular processes,03036 Chromosome and associated proteins [BR:ko03036] // 04812 Cytoskeleton proteins [BR:ko04812],"K03496  parA, soj; chromosome partitioning protein",1831.8086398218952,-0.9226482970302204,0.26206051765712635,-1.6127889115414298,0.10679037597059664,0.3541848963318178,treatment_long.term_vs_ref,669,MED4,WP_011131689.1
TX50_RS00275,TX50_RS00275,aldo/keto reductase,no_significant,09100 Metabolism,09108 Metabolism of cofactors and vitamins,00750 Vitamin B6 metabolism [PATH:ko00750],K05275  E1.1.1.65; pyridoxine 4-dehydrogenase [EC:1.1.1.65],53.64701785325169,-0.5246147738489859,0.20425532524111506,-0.12050982670796555,0.9040792957891929,1,treatment_long.term_vs_ref,960,MED4,WP_011131690.1
TX50_RS00280,TX50_RS00280,class I SAM-dependent RNA methyltransferase,no_significant,09180 Brite Hierarchies,09182 Protein families: genetic information processing,03009 Ribosome biogenesis [BR:ko03009],K25137  rlmL; 23S rRNA (guanine2445-N2)-methyltransferase [EC:2.1.1.173],118.79855733161547,0.5317362999497649,0.2630398913952467,0.12065204171665955,0.9039666465600575,1,treatment_long.term_vs_ref,1122,MED4,WP_011131691.1
TX50_RS00285,TX50_RS00285,phage holin family protein,no_significant,,,,,114.81958310754959,0.7116459820574924,0.24553661168188165,0.8619732129060326,0.3887022586211901,0.960871983311582,treatment_long.term_vs_ref,384,MED4,WP_011131692.1
TX50_RS00290,TX50_RS00290,hypothetical protein,no_significant,,,,,460.4747332745552,0.7865374874807866,0.2036279384820707,1.407161952415562,0.159379370927406,0.48203809738892456,treatment_long.term_vs_ref,459,MED4,WP_011131693.1
TX50_RS00295,TX50_RS00295,hypothetical protein,no_significant,,,,,620.4528015472009,-1.3596454182544462,0.2952165431550894,-2.9119147899609374,0.0035922061417213865,0.020128899173863974,treatment_long.term_vs_ref,360,MED4,WP_011131694.1
TX50_RS00300,smc,chromosome segregation protein SMC,no_significant,09180 Brite Hierarchies,09182 Protein families: genetic information processing,03036 Chromosome and associated proteins [BR:ko03036],K03529  smc; chromosome segregation protein,253.9254989344649,-0.12787308212613394,0.173938068364462,-0,1,1,treatment_long.term_vs_ref,3588,MED4,WP_036930396.1
TX50_RS00305,TX50_RS00305,PRC-barrel domain-containing protein,no_significant,,,,,236.98212962105436,0.5737776641893635,0.2097706061363717,0.35170639751787097,0.7250584622183855,1,treatment_long.term_vs_ref,1020,MED4,WP_036930395.1
TX50_RS00310,TX50_RS00310,hypothetical protein,no_significant,,,,,170.25559862710156,0.030835345298882627,0.2817029961594185,0,1,1,treatment_long.term_vs_ref,1287,MED4,WP_011131697.1
TX50_RS00320,accC,acetyl-CoA carboxylase biotin carboxylase subunit,down,09100 Metabolism,09101 Carbohydrate metabolism // 09102 Energy metabolism // 09103 Lipid metabolism,00620 Pyruvate metabolism [PATH:ko00620] // 00640 Propanoate metabolism [PATH:ko00640] // 00720 Carbon fixation pathways in prokaryotes [PATH:ko00720] // 00061 Fatty acid biosynthesis [PATH:ko00061],"K01961  accC; acetyl-CoA carboxylase, biotin carboxylase subunit [EC:6.4.1.2 6.3.4.14]",630.4097378141845,-1.3789735683217925,0.1463919667299784,-6.004247281840738,1.9222155494362076e-9,3.959764031838588e-8,treatment_long.term_vs_ref,1347,MED4,WP_011131698.1
TX50_RS00325,TX50_RS00325,YggT family protein,no_significant,09180 Brite Hierarchies,09183 Protein families: signaling and cellular processes,02044 Secretion system [BR:ko02044],K02221  yggT; YggT family protein,235.837714069051,-0.7861767083670049,0.2331731548220657,-1.227314133075852,0.2197045456571973,0.6276305510761846,treatment_long.term_vs_ref,303,MED4,WP_011131699.1
TX50_RS00330,TX50_RS00330,photosystem II reaction center X protein,down,,,,,1001.4419426024972,-1.354760952935308,0.20884588255138986,-4.092783360117145,4.2622590065900295e-5,4.318157485364981e-4,treatment_long.term_vs_ref,186,MED4,WP_036930392.1
TX50_RS00335,TX50_RS00335,Ycf66 family protein,no_significant,,,,,3770.0791519065,0.6688318670400994,0.15157340859519897,1.1138620461521187,0.2653383739339281,0.720259656330165,treatment_long.term_vs_ref,930,MED4,WP_011131701.1
TX50_RS00340,TX50_RS00340,high light inducible protein,no_significant,,,,,138.11592324325892,-0.6904514298299069,0.1800443025209241,-1.0578031471324862,0.29014519772871566,0.7651908913073099,treatment_long.term_vs_ref,231,MED4,WP_011131702.1
TX50_RS00345,TX50_RS00345,ABC transporter ATP-binding protein/permease,no_significant,09130 Environmental Information Processing // 09180 Brite Hierarchies,09131 Membrane transport // 09183 Protein families: signaling and cellular processes,02010 ABC transporters [PATH:ko02010] // 02000 Transporters [BR:ko02000],"K02471  bacA, bclA; vitamin B12/bleomycin/antimicrobial peptide transport system ATP-binding/permease protein",825.6216709188466,0.2946432238589523,0.1229130432918775,0,1,1,treatment_long.term_vs_ref,1980,MED4,WP_011131703.1
TX50_RS00350,TX50_RS00350,hypothetical protein,no_significant,,,,,193.10018516444208,0.6691195963975857,0.22845606332216484,0.7402718664511702,0.45913504818840295,1,treatment_long.term_vs_ref,285,MED4,WP_011131704.1
TX50_RS00355,TX50_RS00355,histidine triad nucleotide-binding protein,no_significant,09180 Brite Hierarchies,09183 Protein families: signaling and cellular processes,04147 Exosome [BR:ko04147],"K02503  HINT1, hinT, hit; histidine triad (HIT) family protein",184.07525229805904,0.26658887675284104,0.14676617690684537,0,1,1,treatment_long.term_vs_ref,339,MED4,WP_011131705.1
TX50_RS00360,def,peptide deformylase,no_significant,09190 Not Included in Pathway or Brite,09191 Unclassified: metabolism,99980 Enzymes with EC numbers,"K01462  PDF, def; peptide deformylase [EC:3.5.1.88]",317.37990753539526,0.9491327409919907,0.15638490436707184,2.87196991813079,0.0040792179564350045,0.02224373556244264,treatment_long.term_vs_ref,603,MED4,WP_011131706.1
TX50_RS00365,TX50_RS00365,prolyl oligopeptidase family serine peptidase,no_significant,,,,,81.2995070556717,0.455941673488626,0.2436616617725931,0,1,1,treatment_long.term_vs_ref,1926,MED4,WP_011131707.1
TX50_RS00370,TX50_RS00370,SufS family cysteine desulfurase,no_significant,09100 Metabolism,09106 Metabolism of other amino acids,00450 Selenocompound metabolism [PATH:ko00450],K11717  sufS; cysteine desulfurase / selenocysteine lyase [EC:2.8.1.7 4.4.1.16],254.8193598167768,0.1533279083755292,0.16075835395885424,0,1,1,treatment_long.term_vs_ref,1275,MED4,WP_011131708.1
